{
  "version": "5.0.1",
  "protocolVersion": 1,
  "minimumDashboardVersion": "5.0.1",
  "modName": "FS25_HofDashboard",
  "timestamp": "2026-08-11T12:00:00",
  "currentDay": 6,
  "daysPerPeriod": 1,
  "mapName": "Contract Fixture Map",
  "farm": {
    "farmId": 1,
    "name": "Mein Hof",
    "money": 12889,
    "loan": 0
  },
  "fields": [
    {
      "id": 11,
      "farmId": 1,
      "farmlandId": 11,
      "area": 5.05,
      "fieldStatus": "MIXED",
      "statusPercentages": {
        "ready": 0,
        "growing": 53.7,
        "harvested": 0,
        "tilled": 46.3,
        "withered": 0,
        "fallow": 0
      },
      "fruitType": "CANOLA",
      "fruitTitle": "Raps"
    }
  ],
  "vehicles": [
    {
      "uniqueId": "vehicle-fixture-1",
      "farmId": 1,
      "vehicleCategory": "VEHICLE",
      "vehicleType": "VEHICLE",
      "name": "Fixture Tractor",
      "fillUnits": [
        {
          "kind": "FUEL",
          "fillType": "DIESEL",
          "title": "Diesel",
          "liters": 150,
          "capacity": 300,
          "percent": 50
        }
      ]
    }
  ],
  "vehicleDiagnostics": {
    "seen": 1,
    "exported": 1,
    "failed": 0,
    "skipped": 0
  },
  "animals": [
    {
      "uniqueId": "animal-fixture-1",
      "farmId": 1,
      "animalType": "PIG",
      "totalAnimals": 10,
      "clusters": [],
      "food": { "enabled": true, "level": 1000, "capacity": 5000, "percent": 20 },
      "water": { "enabled": true, "level": 500, "capacity": 1000, "percent": 50 },
      "outputs": []
    }
  ],
  "animalDiagnostics": {
    "seen": 1,
    "exported": 1,
    "failed": 0,
    "skipped": 0
  },
  "beehives": {
    "hiveCount": 0,
    "activeHiveCount": 0,
    "honeyLitersPerHour": 0,
    "pendingHoneyLiters": 0
  },
  "productions": [
    {
      "farmId": 1,
      "name": "Fixture Greenhouse",
      "productions": [
        {
          "id": "tomato",
          "name": "Tomaten",
          "enabled": true,
          "status": 1,
          "cyclesPerHour": 44,
          "inputs": [{ "fillType": "WATER", "amount": 2 }],
          "outputs": [{ "fillType": "TOMATO", "amount": 2 }]
        }
      ],
      "storages": [
        {
          "fillType": "WATER",
          "title": "Wasser",
          "level": 2455,
          "capacity": 20000,
          "percent": 12
        }
      ]
    }
  ],
  "contracts": [
    {
      "farmId": 0,
      "type": "HarvestMission",
      "title": "Ernten",
      "reward": 40041,
      "fieldId": 9,
      "isActive": false,
      "progress": 0
    }
  ],
  "market": [
    {
      "fillType": "CANOLA",
      "title": "Raps",
      "category": "crop",
      "bestPrice": 1292,
      "bestStation": "Sarow AG",
      "stations": [
        {
          "name": "Sarow AG",
          "pricePer1000L": 1292
        }
      ]
    }
  ]
}
